ID;nome;cognome;dataNascita;nazionalita_code;biografia
550e8400-e29b-41d4-a716-446655440101;Italo;Calvino;1923-10-15;IT;Scrittore e giornalista italiano
550e8400-e29b-41d4-a716-446655440102;Elena;Ferrante;1943-01-01;IT;Scrittrice italiana
550e8400-e29b-41d4-a716-446655440103;Umberto;Eco;1932-01-05;IT;Scrittore, filosofo e semiologo italiano
550e8400-e29b-41d4-a716-446655440104;Gabriel;García Márquez;1927-03-06;CO;Scrittore colombiano premio Nobel
550e8400-e29b-41d4-a716-446655440105;Virginia;Woolf;1882-01-25;GB;Scrittrice e saggista britannica